{
  "edition": "2026-pilot",
  "method_version": "ti-1.0-draft",
  "generated_at": "2027-01-10T08:00:00Z",
  "placeholder": true,
  "rankings": [
    {
      "id": "street_speed",
      "metric": "Prędkość komunikacyjna, pojazdy drogowe",
      "unit": "km/h",
      "band": "all_day",
      "day_type": "WEEKDAY",
      "sort": "desc",
      "entries": [
        {
          "rank": 1,
          "city": "miasto-a",
          "display_name": "Miasto A (zastępcze)",
          "value": 18.4,
          "delta_vs_previous_edition": null,
          "median_stop_spacing_m": 520,
          "n_days": 42,
          "n_obs": 812345,
          "network_coverage_share": 0.86,
          "status": "ranked",
          "notes": [],
          "area_definition": "polygon"
        },
        {
          "rank": 2,
          "city": "miasto-b",
          "display_name": "Miasto B (zastępcze)",
          "value": 16.9,
          "delta_vs_previous_edition": null,
          "median_stop_spacing_m": 610,
          "n_days": 39,
          "n_obs": 455210,
          "network_coverage_share": 0.74,
          "status": "ranked",
          "notes": [],
          "area_definition": "polygon"
        },
        {
          "rank": 3,
          "city": "miasto-c",
          "display_name": "Miasto C (zastępcze)",
          "value": 15.2,
          "delta_vs_previous_edition": null,
          "median_stop_spacing_m": 450,
          "n_days": 31,
          "n_obs": 120004,
          "network_coverage_share": 0.63,
          "status": "limited",
          "notes": [
            "Mniej niż 40 dni w oknie edycji"
          ],
          "area_definition": "polygon"
        }
      ]
    },
    {
      "id": "street_peak_penalty",
      "metric": "Kara szczytu popołudniowego względem pasm midday i evening",
      "unit": "%",
      "band": "pm_peak",
      "day_type": "WEEKDAY",
      "sort": "asc",
      "entries": [
        {
          "rank": 1,
          "city": "miasto-b",
          "display_name": "Miasto B (zastępcze)",
          "value": 19.0,
          "delta_vs_previous_edition": null,
          "median_stop_spacing_m": 610,
          "n_days": 39,
          "n_obs": 91234,
          "network_coverage_share": 0.74,
          "status": "ranked",
          "notes": [],
          "area_definition": "polygon"
        },
        {
          "rank": 2,
          "city": "miasto-a",
          "display_name": "Miasto A (zastępcze)",
          "value": 23.5,
          "delta_vs_previous_edition": null,
          "median_stop_spacing_m": 520,
          "n_days": 42,
          "n_obs": 160321,
          "network_coverage_share": 0.86,
          "status": "ranked",
          "notes": [],
          "area_definition": "polygon"
        }
      ]
    }
  ],
  "excluded": [
    {
      "city": "miasto-d",
      "display_name": "Miasto D (zastępcze)",
      "reasons": [
        "no_trip_id"
      ],
      "detail": "Feed VehiclePositions nie podaje trip_id."
    },
    {
      "city": "miasto-e",
      "display_name": "Miasto E (zastępcze)",
      "reasons": [
        "too_few_days",
        "low_network_coverage"
      ]
    }
  ]
}
